pmc_id,pmc_url,title,doi,pmid,journal,year
PMC4909093,https://pmc.ncbi.nlm.nih.gov/articles/PMC4909093/,Microglia-specific targeting by novel capsid-modified AAV6 vectors,10.1038/mtm.2016.26,27308302,Molecular Therapy. Methods & Clinical Development,2016
PMC4919512,https://pmc.ncbi.nlm.nih.gov/articles/PMC4919512/,Early role of vascular dysregulation on late-onset Alzheimer's disease based on multifactorial data-driven analysis,10.1038/ncomms11934,27327500,Nature Communications,2016
PMC4923765,https://pmc.ncbi.nlm.nih.gov/articles/PMC4923765/,Herpes Simplex Virus Type 1 and Other Pathogens are Key Causative Factors in Sporadic Alzheimer’s Disease,10.3233/JAD-142853,26401998,Journal of Alzheimer's Disease,2015
PMC4928318,https://pmc.ncbi.nlm.nih.gov/articles/PMC4928318/,Acetylated tau destabilizes the cytoskeleton in the axon initial segment and is mislocalized to the somatodendritic compartment,10.1186/s13024-016-0109-0,27356871,Molecular Neurodegeneration,2016
PMC4932097,https://pmc.ncbi.nlm.nih.gov/articles/PMC4932097/,Mechanisms of Aβ Clearance and Degradation by Glial Cells,10.3389/fnagi.2016.00160,27458370,Frontiers in Aging Neuroscience,2016
PMC4947104,https://pmc.ncbi.nlm.nih.gov/articles/PMC4947104/,A comprehensive study of the genetic impact of rare variants in SORL1 in European early-onset Alzheimer’s disease,10.1007/s00401-016-1566-9,27026413,Acta Neuropathologica,2016
PMC4947121,https://pmc.ncbi.nlm.nih.gov/articles/PMC4947121/,Intraneuronal aggregation of the β-CTF fragment of APP (C99) induces Aβ-independent lysosomal-autophagic pathology,10.1007/s00401-016-1577-6,27138984,Acta Neuropathologica,2016
PMC4947125,https://pmc.ncbi.nlm.nih.gov/articles/PMC4947125/,"Presynaptic dystrophic neurites surrounding amyloid plaques are sites of microtubule disruption, BACE1 elevation, and increased Aβ generation in Alzheimer’s disease",10.1007/s00401-016-1558-9,26993139,Acta Neuropathologica,2016
PMC4956742,https://pmc.ncbi.nlm.nih.gov/articles/PMC4956742/,Antibiotic-induced perturbations in gut microbial diversity influences neuro-inflammation and amyloidosis in a murine model of Alzheimer’s disease,10.1038/srep30028,27443609,Scientific Reports,2016
PMC4961028,https://pmc.ncbi.nlm.nih.gov/articles/PMC4961028/,The Human Brainnetome Atlas: A New Brain Atlas Based on Connectional Architecture,10.1093/cercor/bhw157,27230218,"Cerebral Cortex (New York, NY)",2016
PMC4962319,https://pmc.ncbi.nlm.nih.gov/articles/PMC4962319/,Internalized Tau sensitizes cells to stress by promoting formation and stability of stress granules,10.1038/srep30498,27460788,Scientific Reports,2016
PMC4962469,https://pmc.ncbi.nlm.nih.gov/articles/PMC4962469/,Tau mediates microtubule bundle architectures mimicking fascicles of microtubules found in the axon initial segment,10.1038/ncomms12278,27452526,Nature Communications,2016
PMC4965059,https://pmc.ncbi.nlm.nih.gov/articles/PMC4965059/,3D Visualization of the Temporal and Spatial Spread of Tau Pathology Reveals Extensive Sites of Tau Accumulation Associated with Neuronal Loss and Recognition Memory Deficit in Aged Tau Transgenic Mice,10.1371/journal.pone.0159463,27466814,PLoS ONE,2016
PMC4980108,https://pmc.ncbi.nlm.nih.gov/articles/PMC4980108/,A protein homeostasis signature in healthy brains recapitulates tissue vulnerability to Alzheimer’s disease,10.1126/sciadv.1600947,27532054,Science Advances,2016
PMC4987924,https://pmc.ncbi.nlm.nih.gov/articles/PMC4987924/,Enrichr: a comprehensive gene set enrichment analysis web server 2016 update,10.1093/nar/gkw377,27141961,Nucleic Acids Research,2016
PMC4995088,https://pmc.ncbi.nlm.nih.gov/articles/PMC4995088/,Widespread transneuronal propagation of α-synucleinopathy triggered in olfactory bulb mimics prodromal Parkinson’s disease,10.1084/jem.20160368,27503075,The Journal of Experimental Medicine,2016
PMC4995359,https://pmc.ncbi.nlm.nih.gov/articles/PMC4995359/,Pittsburgh compound B imaging and cerebrospinal fluid amyloid-β in a multicentre European memory clinic study,10.1093/brain/aww160,27401520,Brain,2016
PMC4995360,https://pmc.ncbi.nlm.nih.gov/articles/PMC4995360/,18F-AV-1451 tau PET imaging correlates strongly with tau neuropathology in MAPT mutation carriers,10.1093/brain/aww163,27357347,Brain,2016
PMC5009806,https://pmc.ncbi.nlm.nih.gov/articles/PMC5009806/,TREM2 deficiency reduces the efficacy of immunotherapeutic amyloid clearance,10.15252/emmm.201606370,27402340,EMBO Molecular Medicine,2016
PMC5010369,https://pmc.ncbi.nlm.nih.gov/articles/PMC5010369/,A C9ORF72/SMCR8-containing complex regulates ULK1 and plays a dual role in autophagy,10.1126/sciadv.1601167,27617292,Science Advances,2016
PMC5013031,https://pmc.ncbi.nlm.nih.gov/articles/PMC5013031/,Differential transgene expression patterns in Alzheimer mouse models revealed by novel human amyloid precursor protein‐specific antibodies,10.1111/acel.12508,27470171,Aging Cell,2016
PMC5021368,https://pmc.ncbi.nlm.nih.gov/articles/PMC5021368/,Self-Organizing 3D Human Neural Tissue Derived from Induced Pluripotent Stem Cells Recapitulate Alzheimer’s Disease Phenotypes,10.1371/journal.pone.0161969,27622770,PLoS ONE,2016
PMC5037366,https://pmc.ncbi.nlm.nih.gov/articles/PMC5037366/,Arachidonic acid mediates the formation of abundant alpha-helical multimers of alpha-synuclein,10.1038/srep33928,27671749,Scientific Reports,2016
PMC5047041,https://pmc.ncbi.nlm.nih.gov/articles/PMC5047041/,Serum neurofilament light chain protein is a measure of disease intensity in frontotemporal dementia,10.1212/WNL.0000000000003154,27581216,Neurology,2016
PMC5049617,https://pmc.ncbi.nlm.nih.gov/articles/PMC5049617/,Identification of key amino acids responsible for the distinct aggregation properties of microtubule‐associated protein 2 and tau,10.1111/jnc.13228,26134402,Journal of Neurochemistry,2015
PMC5052651,https://pmc.ncbi.nlm.nih.gov/articles/PMC5052651/,Exposure to the Functional Bacterial Amyloid Protein Curli Enhances Alpha-Synuclein Aggregation in Aged Fischer 344 Rats and Caenorhabditis elegans,10.1038/srep34477,27708338,Scientific Reports,2016
PMC5058336,https://pmc.ncbi.nlm.nih.gov/articles/PMC5058336/,Human whole genome genotype and transcriptome data for Alzheimer’s and other neurodegenerative diseases,10.1038/sdata.2016.89,27727239,Scientific Data,2016
PMC5073117,https://pmc.ncbi.nlm.nih.gov/articles/PMC5073117/,Risk factor SORL1: from genetic association to functional validation in Alzheimer’s disease,10.1007/s00401-016-1615-4,27638701,Acta Neuropathologica,2016
PMC5088659,https://pmc.ncbi.nlm.nih.gov/articles/PMC5088659/,Integrative network analysis of nineteen brain regions identifies molecular signatures and networks underlying selective regional vulnerability to Alzheimer’s disease,10.1186/s13073-016-0355-3,27799057,Genome Medicine,2016
PMC5098187,https://pmc.ncbi.nlm.nih.gov/articles/PMC5098187/,Serum neurofilament light protein predicts clinical outcome in traumatic brain injury,10.1038/srep36791,27819296,Scientific Reports,2016
PMC5110027,https://pmc.ncbi.nlm.nih.gov/articles/PMC5110027/,Unique pathological tau conformers from Alzheimer’s brains transmit tau pathology in nontransgenic mice,10.1084/jem.20160833,27810929,The Journal of Experimental Medicine,2016
PMC5112579,https://pmc.ncbi.nlm.nih.gov/articles/PMC5112579/,A step-by-step workflow for low-level analysis of single-cell RNA-seq data with Bioconductor,10.12688/f1000research.9501.2,27909575,F1000Research,2016
PMC5114608,https://pmc.ncbi.nlm.nih.gov/articles/PMC5114608/,Mapping synaptic glutamate transporter dysfunction in vivo to regions surrounding Aβ plaques by iGluSnFR two-photon imaging,10.1038/ncomms13441,27834383,Nature Communications,2016
PMC5119496,https://pmc.ncbi.nlm.nih.gov/articles/PMC5119496/,Generation and deposition of Aβ43 by the virtually inactive presenilin‐1 L435F mutant contradicts the presenilin loss‐of‐function hypothesis of Alzheimer's disease,10.15252/emmm.201505952,26988102,EMBO Molecular Medicine,2016
PMC5119954,https://pmc.ncbi.nlm.nih.gov/articles/PMC5119954/,Genetic Drivers of Epigenetic and Transcriptional Variation in Human Immune Cells,10.1016/j.cell.2016.10.026,27863251,Cell,2016
PMC5120370,https://pmc.ncbi.nlm.nih.gov/articles/PMC5120370/,sTREM2 cerebrospinal fluid levels are a potential biomarker for microglia activity in early‐stage Alzheimer's disease and associate with neuronal injury markers,10.15252/emmm.201506123,26941262,EMBO Molecular Medicine,2016
PMC5123296,https://pmc.ncbi.nlm.nih.gov/articles/PMC5123296/,variancePartition: interpreting drivers of variation in complex gene expression studies,10.1186/s12859-016-1323-z,27884101,BMC Bioinformatics,2016
PMC5134833,https://pmc.ncbi.nlm.nih.gov/articles/PMC5134833/,The amyloid-beta forming tripeptide cleavage mechanism of γ-secretase,10.7554/eLife.17578,27580372,eLife,2016
PMC5137165,https://pmc.ncbi.nlm.nih.gov/articles/PMC5137165/,Soluble Amyloid-beta Aggregates from Human Alzheimer’s Disease Brains,10.1038/srep38187,27917876,Scientific Reports,2016
PMC5173282,https://pmc.ncbi.nlm.nih.gov/articles/PMC5173282/,Autophagy flux in CA1 neurons of Alzheimer hippocampus: Increased induction overburdens failing lysosomes to propel neuritic dystrophy,10.1080/15548627.2016.1239003,27813694,Autophagy,2016
PMC5173322,https://pmc.ncbi.nlm.nih.gov/articles/PMC5173322/,Neurodegenerative disease mutations in TREM2 reveal a functional surface and distinct loss-of-function mechanisms,10.7554/eLife.20391,27995897,eLife,2016
PMC5210310,https://pmc.ncbi.nlm.nih.gov/articles/PMC5210310/,Inflammatory pre-conditioning restricts the seeded induction of α-synuclein pathology in wild type mice,10.1186/s13024-016-0142-z,28049533,Molecular Neurodegeneration,2017
PMC5210579,https://pmc.ncbi.nlm.nih.gov/articles/PMC5210579/,Expansion of the Gene Ontology knowledgebase and resources,10.1093/nar/gkw1108,27899567,Nucleic Acids Research,2016
PMC5210595,https://pmc.ncbi.nlm.nih.gov/articles/PMC5210595/,"PANTHER version 11: expanded annotation data from Gene Ontology and Reactome pathways, and data analysis tool enhancements",10.1093/nar/gkw1138,27899595,Nucleic Acids Research,2016
PMC5210637,https://pmc.ncbi.nlm.nih.gov/articles/PMC5210637/,"The STRING database in 2017: quality-controlled protein–protein association networks, made broadly accessible",10.1093/nar/gkw937,27924014,Nucleic Acids Research,2016
PMC5224821,https://pmc.ncbi.nlm.nih.gov/articles/PMC5224821/,Genomics implicates adaptive and innate immunity in Alzheimer's and Parkinson's diseases,10.1002/acn3.369,28097204,Annals of Clinical and Translational Neurology,2016
PMC5225540,https://pmc.ncbi.nlm.nih.gov/articles/PMC5225540/,Tau passive immunization inhibits not only tau but also Aβ pathology,10.1186/s13195-016-0227-5,28073379,Alzheimer's Research & Therapy,2017
PMC5237256,https://pmc.ncbi.nlm.nih.gov/articles/PMC5237256/,The release and trans-synaptic transmission of Tau via exosomes,10.1186/s13024-016-0143-y,28086931,Molecular Neurodegeneration,2017
PMC5241818,https://pmc.ncbi.nlm.nih.gov/articles/PMC5241818/,Massively parallel digital transcriptional profiling of single cells,10.1038/ncomms14049,28091601,Nature Communications,2017
PMC5247583,https://pmc.ncbi.nlm.nih.gov/articles/PMC5247583/,Caloric restriction improves health and survival of rhesus monkeys,10.1038/ncomms14063,28094793,Nature Communications,2017
PMC5263237,https://pmc.ncbi.nlm.nih.gov/articles/PMC5263237/,Coupled Proliferation and Apoptosis Maintain the Rapid Turnover of Microglia in the Adult Brain,10.1016/j.celrep.2016.12.041,28076784,Cell Reports,2017
PMC5263238,https://pmc.ncbi.nlm.nih.gov/articles/PMC5263238/,Major Shifts in Glial Regional Identity Are a Transcriptional Hallmark of Human Brain Aging,10.1016/j.celrep.2016.12.011,28076797,Cell Reports,2017
PMC5267531,https://pmc.ncbi.nlm.nih.gov/articles/PMC5267531/,"Tau and Aβ imaging, CSF measures, and cognition in Alzheimer's disease",10.1126/scitranslmed.aaf2362,27169802,Science translational medicine,2016
PMC5297247,https://pmc.ncbi.nlm.nih.gov/articles/PMC5297247/,Reduction of Abeta amyloid pathology in APPPS1 transgenic mice in the absence of gut microbiota,10.1038/srep41802,28176819,Scientific Reports,2017
PMC5325836,https://pmc.ncbi.nlm.nih.gov/articles/PMC5325836/,Mixed pathologies including chronic traumatic encephalopathy account for dementia in retired association football (soccer) players,10.1007/s00401-017-1680-3,28205009,Acta Neuropathologica,2017
PMC5333515,https://pmc.ncbi.nlm.nih.gov/articles/PMC5333515/,Blood-based NfL,10.1212/WNL.0000000000003680,28179466,Neurology,2017
PMC5335603,https://pmc.ncbi.nlm.nih.gov/articles/PMC5335603/,Astrocyte pathology in a human neural stem cell model of frontotemporal dementia caused by mutant TAU protein,10.1038/srep42991,28256506,Scientific Reports,2017
PMC5339672,https://pmc.ncbi.nlm.nih.gov/articles/PMC5339672/,Soluble TREM2 induces inflammatory responses and enhances microglial survival,10.1084/jem.20160844,28209725,The Journal of Experimental Medicine,2017
PMC5340039,https://pmc.ncbi.nlm.nih.gov/articles/PMC5340039/,Cell-specific deletion of C1qa identifies microglia as the dominant source of C1q in mouse brain,10.1186/s12974-017-0814-9,28264694,Journal of Neuroinflammation,2017
PMC5340347,https://pmc.ncbi.nlm.nih.gov/articles/PMC5340347/,Dementia incidence trend over 1992-2014 in the Netherlands: Analysis of primary care data,10.1371/journal.pmed.1002235,28267788,PLoS Medicine,2017
PMC5341123,https://pmc.ncbi.nlm.nih.gov/articles/PMC5341123/,Apolipoprotein E4 and Insulin Resistance Interact to Impair Cognition and Alter the Epigenome and Metabolome,10.1038/srep43701,28272510,Scientific Reports,2017
PMC5345650,https://pmc.ncbi.nlm.nih.gov/articles/PMC5345650/,The Synucleinopathies: Twenty Years On,10.3233/JPD-179005,28282814,Journal of Parkinson's Disease,2017
PMC5355803,https://pmc.ncbi.nlm.nih.gov/articles/PMC5355803/,Pre-plaque conformational changes in Alzheimer's disease-linked Aβ and APP,10.1038/ncomms14726,28287086,Nature Communications,2017
PMC5360219,https://pmc.ncbi.nlm.nih.gov/articles/PMC5360219/,Genetic assessment of age-associated Alzheimer disease risk: Development and validation of a polygenic hazard score,10.1371/journal.pmed.1002258,28323831,PLoS Medicine,2017
PMC5370101,https://pmc.ncbi.nlm.nih.gov/articles/PMC5370101/,"APP, PSEN1, and PSEN2 mutations in early-onset Alzheimer disease: A genetic screening study of familial and sporadic cases",10.1371/journal.pmed.1002270,28350801,PLoS Medicine,2017
PMC5378956,https://pmc.ncbi.nlm.nih.gov/articles/PMC5378956/,Inhibition of delta-secretase improves cognitive functions in mouse models of Alzheimer's disease,10.1038/ncomms14740,28345579,Nature Communications,2017
PMC5382945,https://pmc.ncbi.nlm.nih.gov/articles/PMC5382945/,"Relationships between flortaucipir PET tau binding and amyloid burden, clinical diagnosis, age and cognition",10.1093/brain/aww334,28077397,Brain,2017
PMC5389999,https://pmc.ncbi.nlm.nih.gov/articles/PMC5389999/,Hyperphosphorylated tau causes reduced hippocampal CA1 excitability by relocating the axon initial segment,10.1007/s00401-017-1674-1,28091722,Acta Neuropathologica,2017
PMC5390006,https://pmc.ncbi.nlm.nih.gov/articles/PMC5390006/,Roles of tau protein in health and disease,10.1007/s00401-017-1707-9,28386764,Acta Neuropathologica,2017
PMC5390007,https://pmc.ncbi.nlm.nih.gov/articles/PMC5390007/,Tau interactome mapping based identification of Otub1 as Tau deubiquitinase involved in accumulation of pathological Tau forms in vitro and in vivo,10.1007/s00401-016-1663-9,28083634,Acta Neuropathologica,2017
PMC5408845,https://pmc.ncbi.nlm.nih.gov/articles/PMC5408845/,"Scater: pre-processing, quality control, normalization and visualization of single-cell RNA-seq data in R",10.1093/bioinformatics/btw777,28088763,Bioinformatics,2017
PMC5411779,https://pmc.ncbi.nlm.nih.gov/articles/PMC5411779/,Evaluation of GRCh38 and de novo haploid genome assemblies demonstrates the enduring quality of the reference assembly,10.1101/gr.213611.116,28396521,Genome Research,2017
PMC5424393,https://pmc.ncbi.nlm.nih.gov/articles/PMC5424393/,Herpes virus seroepidemiology in the adult Swedish population,10.1186/s12979-017-0093-4,28491117,Immunity & Ageing : I & A,2017
PMC5430642,https://pmc.ncbi.nlm.nih.gov/articles/PMC5430642/,Decreased body mass index in the preclinical stage of autosomal dominant Alzheimer’s disease,10.1038/s41598-017-01327-w,28450713,Scientific Reports,2017
PMC5431369,https://pmc.ncbi.nlm.nih.gov/articles/PMC5431369/,Ultrastructural Characterization of the Lower Motor System in a Mouse Model of Krabbe Disease,10.1038/s41598-016-0001-8,28442746,Scientific Reports,2016
PMC5431875,https://pmc.ncbi.nlm.nih.gov/articles/PMC5431875/,In situ click chemistry generation of cyclooxygenase-2 inhibitors,10.1038/s41467-016-0009-6,28232747,Nature Communications,2017
PMC5437271,https://pmc.ncbi.nlm.nih.gov/articles/PMC5437271/,Tau association with synaptic vesicles causes presynaptic dysfunction,10.1038/ncomms15295,28492240,Nature Communications,2017
PMC5446752,https://pmc.ncbi.nlm.nih.gov/articles/PMC5446752/,Late onset Alzheimer’s disease genetics implicates microglial pathways in disease risk,10.1186/s13024-017-0184-x,28549481,Molecular Neurodegeneration,2017
PMC5447308,https://pmc.ncbi.nlm.nih.gov/articles/PMC5447308/,Intrastriatal injection of α-synuclein can lead to widespread synucleinopathy independent of neuroanatomic connectivity,10.1186/s13024-017-0182-z,28552073,Molecular Neurodegeneration,2017
PMC5450588,https://pmc.ncbi.nlm.nih.gov/articles/PMC5450588/,Functional MRI Assessment of Task-Induced Deactivation of the Default Mode Network in Alzheimer’s Disease and At-Risk Older Individuals,10.3233/BEN-2009-0231,19847047,Behavioural Neurology,2009
PMC5461712,https://pmc.ncbi.nlm.nih.gov/articles/PMC5461712/,Characterization of tau prion seeding activity and strains from formaldehyde-fixed tissue,10.1186/s40478-017-0442-8,28587664,Acta Neuropathologica Communications,2017
PMC5470327,https://pmc.ncbi.nlm.nih.gov/articles/PMC5470327/,Stem cell models of Alzheimer’s disease: progress and challenges,10.1186/s13195-017-0268-4,28610595,Alzheimer's Research & Therapy,2017
PMC5470330,https://pmc.ncbi.nlm.nih.gov/articles/PMC5470330/,A Highly Efficient Human Pluripotent Stem Cell Microglia Model Displays a Neuronal-Co-culture-Specific Expression Profile and Inflammatory Response,10.1016/j.stemcr.2017.05.017,28591653,Stem Cell Reports,2017
PMC5479445,https://pmc.ncbi.nlm.nih.gov/articles/PMC5479445/,Helical reconstruction in RELION,10.1016/j.jsb.2017.02.003,28193500,Journal of Structural Biology,2017
PMC5492997,https://pmc.ncbi.nlm.nih.gov/articles/PMC5492997/,Glial contributions to neurodegeneration in tauopathies,10.1186/s13024-017-0192-x,28662669,Molecular Neurodegeneration,2017
PMC5496518,https://pmc.ncbi.nlm.nih.gov/articles/PMC5496518/,Diagnosis and management of dementia with Lewy bodies,10.1212/WNL.0000000000004058,28592453,Neurology,2017
PMC5500003,https://pmc.ncbi.nlm.nih.gov/articles/PMC5500003/,RNA stores tau reversibly in complex coacervates,10.1371/journal.pbio.2002183,28683104,PLoS Biology,2017
PMC5504286,https://pmc.ncbi.nlm.nih.gov/articles/PMC5504286/,SRSF1-dependent nuclear export inhibition of C9ORF72 repeat transcripts prevents neurodegeneration and associated motor deficits,10.1038/ncomms16063,28677678,Nature Communications,2017
PMC5508036,https://pmc.ncbi.nlm.nih.gov/articles/PMC5508036/,In-depth clinico-pathological examination of RNA foci in a large cohort of C9ORF72 expansion carriers,10.1007/s00401-017-1725-7,28508101,Acta Neuropathologica,2017
PMC5508038,https://pmc.ncbi.nlm.nih.gov/articles/PMC5508038/,Amyloid-β accumulation in the CNS in human growth hormone recipients in the UK,10.1007/s00401-017-1703-0,28349199,Acta Neuropathologica,2017
PMC5537986,https://pmc.ncbi.nlm.nih.gov/articles/PMC5537986/,Generation and characterization of new monoclonal antibodies targeting the PHF1 and AT8 epitopes on human tau,10.1186/s40478-017-0458-0,28760159,Acta Neuropathologica Communications,2017
PMC5540680,https://pmc.ncbi.nlm.nih.gov/articles/PMC5540680/,The Lifespan and Turnover of Microglia in the Human Brain,10.1016/j.celrep.2017.07.004,28746864,Cell Reports,2017
PMC5547074,https://pmc.ncbi.nlm.nih.gov/articles/PMC5547074/,Inhibition of glycogen synthase kinase-3 by BTA-EG4 reduces tau abnormalities in an organotypic brain slice culture model of Alzheimer’s disease,10.1038/s41598-017-07906-1,28785087,Scientific Reports,2017
PMC5561579,https://pmc.ncbi.nlm.nih.gov/articles/PMC5561579/,Non-canonical soluble amyloid-beta aggregates and plaque buffering: controversies and future directions for target discovery in Alzheimer’s disease,10.1186/s13195-017-0293-3,28818091,Alzheimer's Research & Therapy,2017
PMC5567154,https://pmc.ncbi.nlm.nih.gov/articles/PMC5567154/,Characterization of pathogenic SORL1 genetic variants for association with Alzheimer’s disease: a clinical interpretation strategy,10.1038/ejhg.2017.87,28537274,European Journal of Human Genetics,2017
PMC5579350,https://pmc.ncbi.nlm.nih.gov/articles/PMC5579350/,APP mouse models for Alzheimer's disease preclinical studies,10.15252/embj.201797397,28768718,The EMBO Journal,2017
PMC5582385,https://pmc.ncbi.nlm.nih.gov/articles/PMC5582385/,Quantification of plasma phosphorylated tau to use as a biomarker for brain Alzheimer pathology: pilot case-control studies including patients with Alzheimer’s disease and down syndrome,10.1186/s13024-017-0206-8,28866979,Molecular Neurodegeneration,2017
PMC5582410,https://pmc.ncbi.nlm.nih.gov/articles/PMC5582410/,18F‐AV‐1451 and CSF T‐tau and P‐tau as biomarkers in Alzheimer's disease,10.15252/emmm.201707809,28743782,EMBO Molecular Medicine,2017
PMC5584112,https://pmc.ncbi.nlm.nih.gov/articles/PMC5584112/,Progranulin deficiency causes impairment of autophagy and TDP-43 accumulation,10.1084/jem.20160999,28778989,The Journal of Experimental Medicine,2017
PMC5589746,https://pmc.ncbi.nlm.nih.gov/articles/PMC5589746/,Tau exacerbates excitotoxic brain damage in an animal model of stroke,10.1038/s41467-017-00618-0,28883427,Nature Communications,2017
PMC5620041,https://pmc.ncbi.nlm.nih.gov/articles/PMC5620041/,Mef2C restrains microglial inflammatory response and is lost in brain ageing in an IFN-I-dependent manner,10.1038/s41467-017-00769-0,28959042,Nature Communications,2017
PMC5623839,https://pmc.ncbi.nlm.nih.gov/articles/PMC5623839/,TREM2 shedding by cleavage at the H157‐S158 bond is accelerated for the Alzheimer's disease‐associated H157Y variant,10.15252/emmm.201707673,28855301,EMBO Molecular Medicine,2017
PMC5623859,https://pmc.ncbi.nlm.nih.gov/articles/PMC5623859/,An Alzheimer‐associated TREM2 variant occurs at the ADAM cleavage site and affects shedding and phagocytic function,10.15252/emmm.201707672,28855300,EMBO Molecular Medicine,2017
PMC5626482,https://pmc.ncbi.nlm.nih.gov/articles/PMC5626482/,Human and nonhuman primate meninges harbor lymphatic vessels that can be visualized noninvasively by MRI,10.7554/eLife.29738,28971799,eLife,2017
PMC5634784,https://pmc.ncbi.nlm.nih.gov/articles/PMC5634784/,Clearance of beta-amyloid is facilitated by apolipoprotein E and circulating high-density lipoproteins in bioengineered human vessels,10.7554/eLife.29595,28994390,eLife,2017
PMC5644120,https://pmc.ncbi.nlm.nih.gov/articles/PMC5644120/,TREM2 deficiency exacerbates tau pathology through dysregulated kinase signaling in a mouse model of tauopathy,10.1186/s13024-017-0216-6,29037207,Molecular Neurodegeneration,2017
PMC5648451,https://pmc.ncbi.nlm.nih.gov/articles/PMC5648451/,Lessons learned about [F-18]-AV-1451 off-target binding from an autopsy-confirmed Parkinson’s case,10.1186/s40478-017-0482-0,29047416,Acta Neuropathologica Communications,2017
PMC5657871,https://pmc.ncbi.nlm.nih.gov/articles/PMC5657871/,"Deaths from Alzheimer’s Disease — United States, 1999–2014",10.15585/mmwr.mm6620a1,28542120,Morbidity and Mortality Weekly Report,2017
PMC5660188,https://pmc.ncbi.nlm.nih.gov/articles/PMC5660188/,Assessment of Variability in the SOMAscan Assay,10.1038/s41598-017-14755-5,29079756,Scientific Reports,2017
PMC5663717,https://pmc.ncbi.nlm.nih.gov/articles/PMC5663717/,Earliest accumulation of β-amyloid occurs within the default-mode network and concurrently affects brain connectivity,10.1038/s41467-017-01150-x,29089479,Nature Communications,2017
PMC5668981,https://pmc.ncbi.nlm.nih.gov/articles/PMC5668981/,Race modifies the relationship between cognition and Alzheimer’s disease cerebrospinal fluid biomarkers,10.1186/s13195-017-0315-1,29096697,Alzheimer's Research & Therapy,2017
PMC5671473,https://pmc.ncbi.nlm.nih.gov/articles/PMC5671473/,Considerations and code for partial volume correcting [18F]-AV-1451 tau PET data,10.1016/j.dib.2017.10.024,29124088,Data in Brief,2017
PMC5674813,https://pmc.ncbi.nlm.nih.gov/articles/PMC5674813/,Multiscale network modeling of oligodendrocytes reveals molecular components of myelin dysregulation in Alzheimer’s disease,10.1186/s13024-017-0219-3,29110684,Molecular Neurodegeneration,2017
PMC5679168,https://pmc.ncbi.nlm.nih.gov/articles/PMC5679168/,Alzheimer’s disease: A matter of blood–brain barrier dysfunction?,10.1084/jem.20171406,29061693,The Journal of Experimental Medicine,2017
PMC5681558,https://pmc.ncbi.nlm.nih.gov/articles/PMC5681558/,Outflow of cerebrospinal fluid is predominantly through lymphatic vessels and is reduced in aged mice,10.1038/s41467-017-01484-6,29127332,Nature Communications,2017
PMC5696646,https://pmc.ncbi.nlm.nih.gov/articles/PMC5696646/,Serum neurofilament light in familial Alzheimer disease,10.1212/WNL.0000000000004667,29070659,Neurology,2017
